{"$schema": "http://json-schema.org/draft-04/hyper-schema#", "links": [{"href": "/api/v1/jobs/schema", "method": "GET", "rel": "describedBy"}, {"href": "/api/v1/jobs", "method": "GET", "rel": "instances", "schema": {"additionalProperties": true, "properties": {"page": {"default": 1, "minimum": 1, "type": "integer"}, "per_page": {"default": 20, "maximum": 1000, "minimum": 1, "type": "integer"}, "sort": {"additionalProperties": false, "properties": {"$uri": {"description": "Sort by $uri in descending order if 'true', ascending order if 'false'.", "type": "boolean"}, "analysis_type": {"description": "Sort by analysis_type in descending order if 'true', ascending order if 'false'.", "type": "boolean"}, "created_at": {"description": "Sort by created_at in descending order if 'true', ascending order if 'false'.", "type": "boolean"}, "name": {"description": "Sort by name in descending order if 'true', ascending order if 'false'.", "type": "boolean"}, "public": {"description": "Sort by public in descending order if 'true', ascending order if 'false'.", "type": "boolean"}}, "type": "object"}, "where": {"additionalProperties": false, "properties": {"$uri": {"anyOf": [{"pattern": "^\\/api\\/v1\\/jobs\\/[^/]+$", "type": "string"}, {"additionalProperties": false, "properties": {"$eq": {"pattern": "^\\/api\\/v1\\/jobs\\/[^/]+$", "type": "string"}}, "required": ["$eq"], "type": "object"}, {"additionalProperties": false, "properties": {"$ne": {"pattern": "^\\/api\\/v1\\/jobs\\/[^/]+$", "type": "string"}}, "required": ["$ne"], "type": "object"}, {"additionalProperties": false, "properties": {"$in": {"default": [], "items": {"pattern": "^\\/api\\/v1\\/jobs\\/[^/]+$", "type": "string"}, "minItems": 0, "type": "array", "uniqueItems": true}}, "required": ["$in"], "type": "object"}]}, "analysis_type": {"anyOf": [{"additionalProperties": false, "properties": {"$startswith": {"minLength": 1, "type": "string"}}, "required": ["$startswith"], "type": "object"}, {"maxLength": 50, "type": ["string", "null"]}, {"additionalProperties": false, "properties": {"$contains": {"minLength": 1, "type": "string"}}, "required": ["$contains"], "type": "object"}, {"additionalProperties": false, "properties": {"$ne": {"maxLength": 50, "type": ["string", "null"]}}, "required": ["$ne"], "type": "object"}, {"additionalProperties": false, "properties": {"$iendswith": {"minLength": 1, "type": "string"}}, "required": ["$iendswith"], "type": "object"}, {"additionalProperties": false, "properties": {"$icontains": {"minLength": 1, "type": "string"}}, "required": ["$icontains"], "type": "object"}, {"additionalProperties": false, "properties": {"$endswith": {"minLength": 1, "type": "string"}}, "required": ["$endswith"], "type": "object"}, {"additionalProperties": false, "properties": {"$istartswith": {"minLength": 1, "type": "string"}}, "required": ["$istartswith"], "type": "object"}, {"additionalProperties": false, "properties": {"$in": {"default": [], "items": {"maxLength": 50, "type": ["string", "null"]}, "minItems": 0, "type": "array", "uniqueItems": true}}, "required": ["$in"], "type": "object"}, {"additionalProperties": false, "properties": {"$eq": {"maxLength": 50, "type": ["string", "null"]}}, "required": ["$eq"], "type": "object"}]}, "created_at": {"anyOf": [{"additionalProperties": false, "properties": {"$gt": {"format": "date-time", "type": "string"}}, "required": ["$gt"], "type": "object"}, {"additionalProperties": false, "properties": {"$gte": {"format": "date-time", "type": "string"}}, "required": ["$gte"], "type": "object"}, {"format": "date-time", "type": "string"}, {"additionalProperties": false, "properties": {"$ne": {"format": "date-time", "type": "string"}}, "required": ["$ne"], "type": "object"}, {"additionalProperties": false, "properties": {"$lt": {"format": "date-time", "type": "string"}}, "required": ["$lt"], "type": "object"}, {"additionalProperties": false, "properties": {"$lte": {"format": "date-time", "type": "string"}}, "required": ["$lte"], "type": "object"}, {"additionalProperties": false, "properties": {"$between": {"default": [], "items": {"format": "date-time", "type": "string"}, "maxItems": 2, "minItems": 2, "type": "array"}}, "required": ["$between"], "type": "object"}, {"additionalProperties": false, "properties": {"$eq": {"format": "date-time", "type": "string"}}, "required": ["$eq"], "type": "object"}]}, "name": {"anyOf": [{"additionalProperties": false, "properties": {"$startswith": {"minLength": 1, "type": "string"}}, "required": ["$startswith"], "type": "object"}, {"maxLength": 60, "type": ["string", "null"]}, {"additionalProperties": false, "properties": {"$contains": {"minLength": 1, "type": "string"}}, "required": ["$contains"], "type": "object"}, {"additionalProperties": false, "properties": {"$ne": {"maxLength": 60, "type": ["string", "null"]}}, "required": ["$ne"], "type": "object"}, {"additionalProperties": false, "properties": {"$iendswith": {"minLength": 1, "type": "string"}}, "required": ["$iendswith"], "type": "object"}, {"additionalProperties": false, "properties": {"$icontains": {"minLength": 1, "type": "string"}}, "required": ["$icontains"], "type": "object"}, {"additionalProperties": false, "properties": {"$endswith": {"minLength": 1, "type": "string"}}, "required": ["$endswith"], "type": "object"}, {"additionalProperties": false, "properties": {"$istartswith": {"minLength": 1, "type": "string"}}, "required": ["$istartswith"], "type": "object"}, {"additionalProperties": false, "properties": {"$in": {"default": [], "items": {"maxLength": 60, "type": ["string", "null"]}, "minItems": 0, "type": "array", "uniqueItems": true}}, "required": ["$in"], "type": "object"}, {"additionalProperties": false, "properties": {"$eq": {"maxLength": 60, "type": ["string", "null"]}}, "required": ["$eq"], "type": "object"}]}, "public": {"anyOf": [{"default": false, "type": ["boolean", "null"]}, {"additionalProperties": false, "properties": {"$eq": {"default": false, "type": ["boolean", "null"]}}, "required": ["$eq"], "type": "object"}, {"additionalProperties": false, "properties": {"$ne": {"default": false, "type": ["boolean", "null"]}}, "required": ["$ne"], "type": "object"}, {"additionalProperties": false, "properties": {"$in": {"default": [], "items": {"default": false, "type": ["boolean", "null"]}, "minItems": 0, "type": "array", "uniqueItems": true}}, "required": ["$in"], "type": "object"}]}}, "type": "object"}}, "type": "object"}, "targetSchema": {"items": {"$ref": "#"}, "type": "array"}}, {"href": "/api/v1/jobs/{id}/run", "method": "POST", "rel": "run", "schema": {"additionalProperties": false, "properties": {"force": {"default": false, "type": "boolean"}, "job_args": {"additionalProperties": {"type": ["null", "string", "number", "boolean", "object", "array"]}, "type": "object"}, "sample": {"anyOf": [{"additionalProperties": false, "properties": {"$ref": {"pattern": "^\\/api\\/v1\\/samples\\/[^/]+$", "type": "string"}}, "type": "object"}, {"maxLength": 16, "type": ["string", "null"]}]}}, "required": ["sample", "job_args"], "type": "object"}, "targetSchema": {"additionalProperties": false, "properties": {"$ref": {"pattern": "^\\/api\\/v1\\/analyses\\/[^/]+$", "type": "string"}}, "type": "object"}}, {"href": "/api/v1/jobs/{id}", "method": "GET", "rel": "self", "targetSchema": {"$ref": "#"}}], "properties": {"$uri": {"pattern": "^\\/api\\/v1\\/jobs\\/[^/]+$", "readOnly": true, "type": "string"}, "analysis_type": {"maxLength": 50, "type": ["string", "null"]}, "created_at": {"format": "date-time", "readOnly": true, "type": "string"}, "name": {"maxLength": 60, "type": ["string", "null"]}, "public": {"default": false, "type": ["boolean", "null"]}}, "type": "object"}